<?xml version="1.0" encoding="UTF-8" ?>
<!DOCTYPE schule SYSTEM "schule.dtd">

<schule>

    <studiengaenge>
        <studiengang id="inf">BSC Informatik</studiengang>
        <studiengang id="wi">Bsc Wirtschaftsinformatik</studiengang>
    </studiengaenge>

    <module>
        <modul kuerzel="m1" studiengang="inf wi">Modul Eins</modul>
        <modul kuerzel="m2" studiengang="wi">Modul Zwei</modul>
    </module>

    <personen>
        <dozent geschlecht="m" unterrichtet="m1 m2">
            <name>Dozent</name>
            <vorname>Hans</vorname>
            <adresse>xxx</adresse>
            <geburtsdatum>1.1.1970</geburtsdatum>
            <ahv-nummer>1.2.3.4.5</ahv-nummer>
        </dozent>
        <student geschlecht="m">
            <name>Student</name>
            <vorname>Hans</vorname>
            <adresse>xxx</adresse>
            <geburtsdatum>1.1.1970</geburtsdatum>
            <ahv-nummer>1.2.3.4.5</ahv-nummer>
            <pruefungsnote modul="m1" datum="13.01.2016">5</pruefungsnote>
            <pruefungsnote modul="m2" datum="13.01.2016">3</pruefungsnote>
        </student>
    </personen>
</schule>
